{
  "schema_version": "keddeh.module-index/v1",
  "module_id": "web-domain-authority",
  "display_name": "KEDDEH Web and Authoritative DNS Package",
  "version": "1.0.0",
  "authority_class": "web-domain",
  "source_paths": [
    "keddeh/keddeh-com-integrated-website/README.md",
    "keddeh/keddeh-com-integrated-website/index.html",
    "keddeh/keddeh-com-integrated-website/server/docker-compose.yml",
    "keddeh/keddeh-com-integrated-website/server/named.conf",
    "keddeh/keddeh-com-integrated-website/server/zones/db.keddeh.com",
    "keddeh/keddeh-com-integrated-website/server/vfs-storage/README.md"
  ],
  "execution": {
    "class": "external-interface",
    "activation_default": false,
    "command": [],
    "health_command": [],
    "required_env": [
      "KEDDEH_PUBLIC_HOST_ID"
    ],
    "service_type": "external"
  },
  "dependencies": [
    "authority-root",
    "governance-network"
  ],
  "systemd": {
    "unit": "keddeh-module@.service",
    "health_unit": "keddeh-module-health@.service",
    "target": "keddeh-runtime.target",
    "restart_policy": "no"
  },
  "wasm": {
    "abi": "wasi-preview1-command+wit-contract",
    "world": "keddeh:runtime/keddeh-module@1.0.0",
    "wit": "packaging/wasm/wit/keddeh-runtime.wit",
    "adapter_artifact": "packaging/wasm/artifacts/keddeh_module_guest.wasm",
    "sha256": null,
    "build_status": "SOURCE_DEFINED_PENDING_CI"
  },
  "vfs": {
    "read_only": [
      "keddeh/keddeh-com-integrated-website/README.md",
      "keddeh/keddeh-com-integrated-website/index.html",
      "keddeh/keddeh-com-integrated-website/server/docker-compose.yml",
      "keddeh/keddeh-com-integrated-website/server/named.conf",
      "keddeh/keddeh-com-integrated-website/server/zones/db.keddeh.com",
      "keddeh/keddeh-com-integrated-website/server/vfs-storage/README.md"
    ],
    "read_write": [
      "/var/lib/keddeh/modules/web-domain-authority"
    ]
  },
  "network": {
    "mode": "external",
    "listen": [
      {
        "protocol": "udp",
        "port": 53,
        "purpose": "authoritative DNS"
      },
      {
        "protocol": "tcp",
        "port": 53,
        "purpose": "authoritative DNS"
      }
    ],
    "connect": []
  },
  "lifecycle": {
    "preflight": "validate-index",
    "start": "validate-and-register",
    "health": "emit-index-and-receipt-readback",
    "stop": "no-op"
  },
  "evidence": {
    "state_root_path": "/var/lib/keddeh/modules/web-domain-authority/state-root.json",
    "phase_root_path": "/var/lib/keddeh/modules/web-domain-authority/phase-root.json",
    "receipt_path": "/var/lib/keddeh/modules/web-domain-authority/receipts.jsonl",
    "generator_id": "keddeh-module-runner:web-domain-authority",
    "verifier_id": "keddeh-module-verifier:web-domain-authority",
    "promotion_status": "SOURCE_DEFINED_PENDING_BUILD_AND_RUNTIME_READBACK"
  }
}
