{
  "schema_version": "keddeh.module-index/v1",
  "module_id": "runtime-backbone",
  "display_name": "KEDDEH Mesh Backbone",
  "version": "1.0.0",
  "authority_class": "server-runtime",
  "source_paths": [
    "runtime/backbone/keddeh_mesh_backbone.py",
    "runtime/backbone/keddeh_global_edge_qualification.py",
    "runtime/backbone/config/node.env.example",
    "runtime/backbone/systemd/keddeh-backbone@.service"
  ],
  "execution": {
    "class": "native",
    "activation_default": false,
    "command": [
      "/usr/bin/python3",
      "runtime/backbone/keddeh_mesh_backbone.py"
    ],
    "health_command": [],
    "required_env": [
      "KEX_NODE_ID",
      "KEX_MESH_SECRET"
    ],
    "service_type": "simple"
  },
  "dependencies": [
    "authority-root",
    "runtime-domain-authority",
    "governance-network"
  ],
  "systemd": {
    "unit": "keddeh-module@.service",
    "health_unit": "keddeh-module-health@.service",
    "target": "keddeh-runtime.target",
    "restart_policy": "on-failure"
  },
  "wasm": {
    "abi": "wasi-preview1-command+wit-contract",
    "world": "keddeh:runtime/keddeh-module@1.0.0",
    "wit": "packaging/wasm/wit/keddeh-runtime.wit",
    "adapter_artifact": "packaging/wasm/artifacts/keddeh_module_guest.wasm",
    "sha256": null,
    "build_status": "SOURCE_DEFINED_PENDING_CI"
  },
  "vfs": {
    "read_only": [
      "runtime/backbone/keddeh_mesh_backbone.py",
      "runtime/backbone/keddeh_global_edge_qualification.py",
      "runtime/backbone/config/node.env.example",
      "runtime/backbone/systemd/keddeh-backbone@.service"
    ],
    "read_write": [
      "/var/lib/keddeh/modules/runtime-backbone"
    ]
  },
  "network": {
    "mode": "declared-native",
    "listen": [
      {
        "protocol": "tcp",
        "port": 16001,
        "purpose": "authenticated mesh backbone"
      }
    ],
    "connect": [
      "declared peers"
    ]
  },
  "lifecycle": {
    "preflight": "validate-index",
    "start": "guarded-native-exec",
    "health": "emit-index-and-receipt-readback",
    "stop": "systemd-sigterm"
  },
  "evidence": {
    "state_root_path": "/var/lib/keddeh/modules/runtime-backbone/state-root.json",
    "phase_root_path": "/var/lib/keddeh/modules/runtime-backbone/phase-root.json",
    "receipt_path": "/var/lib/keddeh/modules/runtime-backbone/receipts.jsonl",
    "generator_id": "keddeh-module-runner:runtime-backbone",
    "verifier_id": "keddeh-module-verifier:runtime-backbone",
    "promotion_status": "SOURCE_DEFINED_PENDING_BUILD_AND_RUNTIME_READBACK"
  }
}
