{
  "schema_version": "keddeh.module-index/v1",
  "module_id": "evidence-ledger-data",
  "display_name": "Qualification Evidence Inputs",
  "version": "1.0.0",
  "authority_class": "evidence",
  "source_paths": [
    "evidence/README.md",
    "evidence/KEX_DA_SCALING_BENCHMARK_R4_OPTIMIZED.json"
  ],
  "execution": {
    "class": "data-only",
    "activation_default": true,
    "command": [],
    "health_command": [],
    "required_env": [],
    "service_type": "oneshot"
  },
  "dependencies": [
    "authority-root"
  ],
  "systemd": {
    "unit": "keddeh-module@.service",
    "health_unit": "keddeh-module-health@.service",
    "target": "keddeh-runtime.target",
    "restart_policy": "no"
  },
  "wasm": {
    "abi": "wasi-preview1-command+wit-contract",
    "world": "keddeh:runtime/keddeh-module@1.0.0",
    "wit": "packaging/wasm/wit/keddeh-runtime.wit",
    "adapter_artifact": "packaging/wasm/artifacts/keddeh_module_guest.wasm",
    "sha256": null,
    "build_status": "SOURCE_DEFINED_PENDING_CI"
  },
  "vfs": {
    "read_only": [
      "evidence/README.md",
      "evidence/KEX_DA_SCALING_BENCHMARK_R4_OPTIMIZED.json"
    ],
    "read_write": [
      "/var/lib/keddeh/modules/evidence-ledger-data"
    ]
  },
  "network": {
    "mode": "none",
    "listen": [],
    "connect": []
  },
  "lifecycle": {
    "preflight": "validate-index",
    "start": "validate-and-register",
    "health": "emit-index-and-receipt-readback",
    "stop": "no-op"
  },
  "evidence": {
    "state_root_path": "/var/lib/keddeh/modules/evidence-ledger-data/state-root.json",
    "phase_root_path": "/var/lib/keddeh/modules/evidence-ledger-data/phase-root.json",
    "receipt_path": "/var/lib/keddeh/modules/evidence-ledger-data/receipts.jsonl",
    "generator_id": "keddeh-module-runner:evidence-ledger-data",
    "verifier_id": "keddeh-module-verifier:evidence-ledger-data",
    "promotion_status": "SOURCE_DEFINED_PENDING_BUILD_AND_RUNTIME_READBACK"
  }
}
