{
  "schema_version": "keddeh.module-index/v1",
  "module_id": "runtime-unification",
  "display_name": "KEDDEH Runtime Unification V1",
  "version": "1.0.0",
  "authority_class": "server-runtime",
  "source_paths": [
    "keddeh/runtime/runtime_unification_v1.py",
    "keddeh/runtime/RUNTIME_UNIFICATION_V1_RECEIPT_20261006.md"
  ],
  "execution": {
    "class": "native",
    "activation_default": false,
    "command": [
      "/usr/bin/python3",
      "keddeh/runtime/runtime_unification_v1.py"
    ],
    "health_command": [],
    "required_env": [],
    "service_type": "simple"
  },
  "dependencies": [
    "authority-root"
  ],
  "systemd": {
    "unit": "keddeh-module@.service",
    "health_unit": "keddeh-module-health@.service",
    "target": "keddeh-runtime.target",
    "restart_policy": "on-failure"
  },
  "wasm": {
    "abi": "wasi-preview1-command+wit-contract",
    "world": "keddeh:runtime/keddeh-module@1.0.0",
    "wit": "packaging/wasm/wit/keddeh-runtime.wit",
    "adapter_artifact": "packaging/wasm/artifacts/keddeh_module_guest.wasm",
    "sha256": null,
    "build_status": "SOURCE_DEFINED_PENDING_CI"
  },
  "vfs": {
    "read_only": [
      "keddeh/runtime/runtime_unification_v1.py",
      "keddeh/runtime/RUNTIME_UNIFICATION_V1_RECEIPT_20261006.md"
    ],
    "read_write": [
      "/var/lib/keddeh/modules/runtime-unification"
    ]
  },
  "network": {
    "mode": "none",
    "listen": [],
    "connect": []
  },
  "lifecycle": {
    "preflight": "validate-index",
    "start": "guarded-native-exec",
    "health": "emit-index-and-receipt-readback",
    "stop": "systemd-sigterm"
  },
  "evidence": {
    "state_root_path": "/var/lib/keddeh/modules/runtime-unification/state-root.json",
    "phase_root_path": "/var/lib/keddeh/modules/runtime-unification/phase-root.json",
    "receipt_path": "/var/lib/keddeh/modules/runtime-unification/receipts.jsonl",
    "generator_id": "keddeh-module-runner:runtime-unification",
    "verifier_id": "keddeh-module-verifier:runtime-unification",
    "promotion_status": "SOURCE_DEFINED_PENDING_BUILD_AND_RUNTIME_READBACK"
  }
}
